{"schema_version":"unirouter.source-evidence.component-package.v1","product":"unirouter","profile":"poc_source_evidence","signature_purpose":"source_evidence","signature_domain":"unirouter.source-evidence.component.v1","claim_scope":"unirouter.poc-source-facts.v1","runtime_observation":"not_claimed","integration_control":{"pin_schema_version":"unirouter.integration-control.n1-pin.v1","pin_sha256":"sha256:51ca89ef23eefc793bb05c03083e8a0f545eb59e54820fb16dffcd91e8fe8e4a"},"artifacts":[{"schema_version":"unirouter.execution-evidence.bundle.v2","path":"unirouter.execution-evidence-v2.compatibility-pin.json","sha256":"sha256:922e7a54bd03651fbd7207177773ea4e8e64b657cc8017cd366e68a167eb0edb"},{"schema_version":"unirouter.integration-control.n1-pin.v1","path":"unirouter.integration-control.n1-pin.v1.schema.json","sha256":"sha256:2c4ca492e70db670cef1c3dd589bfa14edcdbff1691df86f174a51832e473590"},{"schema_version":"unirouter.poc-source-facts.v1","path":"unirouter.poc-source-facts.v1.schema.json","sha256":"sha256:7585de6ba299721077d4a5b691b3d1c922a50e5298dfaad20c0a587c4c4942dd"},{"schema_version":"unirouter.release-state-identity.v1","path":"unirouter.release-state-identity.v1.schema.json","sha256":"sha256:035c794487fcff63d8a3d845d3da5a2640e42ca6c9ad7648588979bd6e7dad7e"},{"schema_version":"unirouter.source-evidence-scope-receipt.v1","path":"unirouter.source-evidence-scope-receipt.v1.schema.json","sha256":"sha256:b89e6982967024fd95528faef3f3c73e0f5ca009723c4661d864a90f0ad2f80b"},{"schema_version":"unirouter.source-evidence.component-manifest.v1","path":"unirouter.source-evidence.component-manifest.v1.schema.json","sha256":"sha256:c1a7454693dfab72f3ca060d1c51c40ec5381abcceb147448104380d576e94c4"},{"schema_version":"unirouter.source-evidence.component-package.v1","path":"unirouter.source-evidence.component-package.v1.schema.json","sha256":"sha256:e792969b5b4a2bc8d376eebed5517fe2cb7273f2f5152da8854ddb41892d2cde"},{"schema_version":"unirouter.source-evidence.component-verification-receipt.v1","path":"unirouter.source-evidence.component-verification-receipt.v1.schema.json","sha256":"sha256:d858e1e821ac902a19c3901a20170ae89f14400a408b77678e60deab38dd08f7"},{"schema_version":"unirouter.source-evidence.component-verifier-release.v1","path":"unirouter.source-evidence.component-verifier-release.v1.schema.json","sha256":"sha256:d51a740c227f8cabf8a8d782c3ed0330f2ea935cde159ddd88568da9e329e02a"},{"schema_version":"unirouter.source-evidence.detached-signature.v1","path":"unirouter.source-evidence.detached-signature.v1.schema.json","sha256":"sha256:f68266b90840bf4cc44975e51523901568017eb0396cff9a5a34f155d6f39331"},{"schema_version":"unirouter.source-evidence.request-set.v1","path":"unirouter.source-evidence.request-set.v1.schema.json","sha256":"sha256:1ef2220ee58017fa34999f0cc97ffc3792bd8139b2f1c533fe0271186e285dc1"},{"schema_version":"unirouter.source-evidence.source-scope.v1","path":"unirouter.source-evidence.source-scope.v1.schema.json","sha256":"sha256:259fdb0208f6992b96470cc5e1e12ae52840ed04db95c8970b30bb55dba37810"},{"schema_version":"unirouter.source-evidence.trust-set.v1","path":"unirouter.source-evidence.trust-set.v1.schema.json","sha256":"sha256:c3dc4f2c106ec2f59d023037e1d7dfee53db3311ff9332facb2fdd18f8be9802"}]}